{
  "event_id": "00000000-0000-4000-8000-000000000001",
  "event_type": "ClinicCapacityPublished",
  "schema_version": 1,
  "occurred_at": "2026-10-07T00:05:00Z",
  "source": "care-delivery",
  "aggregate_id": "clinic-demo/2026-10-06",
  "aggregate_version": 1,
  "region_id": "region-demo",
  "correlation_id": "00000000-0000-4000-8000-000000000002",
  "payload": {
    "clinic_id": "clinic-demo",
    "period_start": "2026-10-06",
    "period_end": "2026-10-07",
    "available_slots": 120,
    "booked_slots": 80
  }
}
